tweet_date,tweet_content,tweet_id,tweet_likes,tweet_replies,tweet_retweets,tweet_quotes,user_username,user_id,user_followers,user_friends,user_statuses,user_verified2017-05-11 20:30:01+00:00,"b""In order to build a Britain #ForTheMany young people need to be a part of it. Watch and share @JermainJackman's message \xe2\x86\x93 #RegisterToVote https://t.co/jBXJiEvpEW""",862766768904749056,250,18,307,11,UKLabour,14291684,906180,11526,30873,True
2017-05-11 13:24:13+00:00,"b""In order to build a Britain #ForTheMany young people need to be a part of it. Watch and share @JermainJackman's message \xe2\x86\x93 #RegisterToVote https://t.co/iPCy5cj4yz""",862659612822130689,814,33,985,45,UKLabour,14291684,906180,11526,30873,True
2017-06-02 21:50:41+00:00,b'Labour is asking corporations to pay a bit more to build a better society which delivers #ForTheMany. #BBCQT #GE2017 https://t.co/BuY80FSGpm',870759603184832512,5850,312,2688,106,jeremycorbyn,117777690,2437876,2950,15241,True
2017-06-02 20:59:59+00:00,b'.@Theresa_May has spent #GE2017 avoiding a debate with me because she knows her record of failure and unfairness is indefensible. #BBCQT https://t.co/0xqeXuZWhS',870746842979553281,8897,367,4450,114,jeremycorbyn,117777690,2437876,2950,15241,True
2017-06-02 18:52:53+00:00,b'.@Theresa_May has refused to stand up to Donald Trump after he pulled the United States out of the Paris Climate Change Deal. #GE2017 #BBCQT https://t.co/izlqXJVXpy',870714854973353984,3539,181,1769,103,jeremycorbyn,117777690,2437876,2950,15241,True
2017-06-02 16:15:01+00:00,"b'.@Conservatives have failed to give our regions, industries, businesses &amp; workers the support they need. They govern for the few #VoteLabour https://t.co/GKEzan22R2'",870675128073543680,830,41,444,5,jeremycorbyn,117777690,2437876,2950,15241,True
2017-06-02 16:00:03+00:00,"b""Labour's National Investment Bank will drive investment and growth in Britain\xe2\x80\x99s economy so it delivers #ForTheMany. #VoteLabour https://t.co/rSnYs6zOce""",870671359528935426,698,45,403,12,jeremycorbyn,117777690,2437876,2950,15241,True
2017-06-02 12:42:43+00:00,"b'Tonight\'s the final ""debate"" of the #GE2017 campaign, but @Theresa_May &amp; I will be on #BBCQT separately because she\'s refusing to take me on https://t.co/gpFdb7YL4J'",870621700152582145,12562,656,7409,653,jeremycorbyn,117777690,2437876,2950,15241,True
2017-06-01 07:34:37+00:00,"b"".@Conservatives and @UKIP's plan to keep lowering corporation tax means continued crisis in our schools, NHS and social care. #BBCDebate https://t.co/lOpOHM7n0l""",870181776341311488,4510,203,2624,126,jeremycorbyn,117777690,2437876,2950,15241,True
2017-05-31 20:34:54+00:00,"b'Tonight we saw the real choice facing our country. On 8 June, you have the power to decide. Vote Labour #ForTheMany, not the few. #BBCDebate https://t.co/Z923oBnWnZ'",870015752048443392,8693,390,4156,150,jeremycorbyn,117777690,2437876,2950,15241,True
2017-05-31 20:00:47+00:00,"b'There is a clear choice at this election: Labour who will build a Britain #ForTheMany, or the Tories who govern only for the few. #BBCDebate https://t.co/eZj3smrOak'",870007168841527300,9842,380,5104,189,jeremycorbyn,117777690,2437876,2950,15241,True
2017-05-31 18:29:49+00:00,"b""At tonight's debate I will set out Labour's vision of a Britain that delivers #ForTheMany. The #BBCDebate starts in a few minutes. Tune in.""",869984277148127238,3236,161,816,27,jeremycorbyn,117777690,2437876,2950,15241,True
2017-05-31 15:16:38+00:00,"b""Britain deserves to see a debate between the two candidates for Prime Minister. Refusing to join tonight's #BBCdebate is a sign of weakness. https://t.co/nsTjv12kS6""",869935661574492161,12740,981,7044,1077,jeremycorbyn,117777690,2437876,2950,15241,True
2017-05-31 14:31:17+00:00,"b""Sorry that taking part in #BBCDebate means I won't be able to join the brilliant @JonAshworth &amp; @AngelaRayner at events in Stroud &amp; Bristol. https://t.co/NjS2wGLj0E""",869924247501770752,1762,124,553,49,jeremycorbyn,117777690,2437876,2950,15241,True
2017-05-31 13:43:34+00:00,"b""At tonight's #BBCdebate I'll set out our vision of a Britain #ForTheMany. Will @Theresa_May come &amp; defend her record of working for the few? https://t.co/OCFgWQsbWY""",869912239389773827,4349,240,2418,170,jeremycorbyn,117777690,2437876,2950,15241,True
2017-05-31 12:14:25+00:00,b'The Tories have treated the public with contempt. Refusing to join me at #BBCdebate tonight would be another sign of @Theresa_May\xe2\x80\x99s weakness https://t.co/RalIlKWjpX',869889802375704576,7664,462,4708,294,jeremycorbyn,117777690,2437876,2950,15241,True
2017-05-31 07:19:25+00:00,b'The future of our public services are at stake in #GE2017. Labour will protect them and build a country #ForTheMany. https://t.co/S5iaim9279',869815563694034944,1161,72,790,23,jeremycorbyn,117777690,2437876,2950,15241,True
2017-05-30 06:00:02+00:00,"b"".@Theresa_May won't take me on in a debate but here's what it might look like if she did and we debated education. #BattleForNumber10 https://t.co/ma5YFsv1lx""",869433199859908608,14609,410,8061,365,jeremycorbyn,117777690,2437876,2950,15241,True
2017-05-29 21:40:17+00:00,"b'We will deliver a profound change in our society.\n\nBritain, under a Labour government, will work #ForTheMany. #BattleForNumber10 https://t.co/k1Yzn3Kx0R'",869307432497033217,9239,337,4661,236,jeremycorbyn,117777690,2437876,2950,15241,True
2017-05-29 21:11:08+00:00,"b""Well, at least there is one Jeremy that @Theresa_May isn't too scared to debate #BattleForNumber10""",869300096516726786,46941,1092,19938,2199,jeremycorbyn,117777690,2437876,2950,15241,True
2017-05-29 20:51:19+00:00,b'The choice at this election is between @Conservatives who will deliver for the few &amp; Labour who will deliver #ForTheMany. #BattleForNumber10 https://t.co/nnsKNrehwB',869295107568279552,13264,455,7007,330,jeremycorbyn,117777690,2437876,2950,15241,True
2017-05-29 11:31:14+00:00,"b'With 10 days to go in #GE2017, please volunteer for @UKLabour &amp; help spread our message: #ForTheMany, not the few: https://t.co/f9IrKuOeAm'",869154159538425856,1570,109,1022,42,jeremycorbyn,117777690,2437876,2950,15241,True
2017-05-28 18:14:55+00:00,"b""I'm in Scotland this evening. Scots have a choice at #GE2017 between Tories &amp; SNP delivering for the few or @UKLabour delivering #ForTheMany https://t.co/JWbGqDnZ8z""",868893361746432000,1359,301,650,97,jeremycorbyn,117777690,2437876,2950,15241,True
2017-05-28 08:30:01+00:00,"b""It's the penultimate Sunday of the #GE2017 campaign. We need you out talking to people #ForTheMany. Get involved \xe2\x86\x92 https://t.co/f9IrKuOeAm""",868746165365469185,481,38,284,8,jeremycorbyn,117777690,2437876,2950,15241,True
2017-05-28 08:00:04+00:00,b'This is the penultimate Sunday of the #GE2017 campaign. We need you out canvassing for Labour. Get involved today \xe2\x86\x92 https://t.co/f9IrKv5PrU https://t.co/zruXzKbAQr',868738629132099584,987,65,560,25,jeremycorbyn,117777690,2437876,2950,15241,True
2017-05-28 07:27:42+00:00,b'This is the penultimate Sunday of #GE2017. Watch this. Share this. And get canvassing for Labour today \xe2\x86\x92 https://t.co/f9IrKuOeAm https://t.co/MVH3lAQv9u',868730486255955968,563,87,436,38,jeremycorbyn,117777690,2437876,2950,15241,True
2017-05-27 09:30:04+00:00,b'This is the penultimate weekend of the #GE2017 campaign. We need you out talking to people for Labour. Get involved: https://t.co/f9IrKv5PrU https://t.co/zbsRFHRmQo',868398890977853440,1180,72,692,40,jeremycorbyn,117777690,2437876,2950,15241,True
2017-05-27 09:00:02+00:00,"b""It's the penultimate weekend of the #GE2017 campaign. We need you out talking to people #ForTheMany. Get involved \xe2\x86\x92 https://t.co/f9IrKuOeAm""",868391332276031488,603,47,403,21,jeremycorbyn,117777690,2437876,2950,15241,True
2017-05-26 20:30:03+00:00,b'This is the penultimate weekend of the #GE2017 campaign. We need you out talking to people for Labour. Get involved: https://t.co/f9IrKv5PrU https://t.co/Nqm55rklYU',868202594165899265,1815,114,1085,50,jeremycorbyn,117777690,2437876,2950,15241,True
2017-05-26 11:08:02+00:00,"b'If you missed my key #GE2017 speech on standing together for democracy, you can watch it here: https://t.co/aP6gglQ2YC https://t.co/jpvCrXWTp3'",868061159504711681,1980,131,1132,78,jeremycorbyn,117777690,2437876,2950,15241,True
2017-05-26 10:04:59+00:00,b'Live in a few minutes: Watch my key #GE2017 speech on standing together for democracy \xe2\x86\x92 https://t.co/aP6gglQ2YC https://t.co/S0dUbnyP8a',868045290657460225,664,61,293,18,jeremycorbyn,117777690,2437876,2950,15241,True
2017-05-26 09:06:02+00:00,"b'My 11am speech: To keep you and your family safe, our approach will involve change at home and change abroad #GE2017 https://t.co/AIk3TyGLf6'",868030453919436800,2550,246,1583,97,jeremycorbyn,117777690,2437876,2950,15241,True
2017-05-22 21:15:14+00:00,b'Listen to @PalomaFaith and register to vote by midnight \xe2\x86\x92 https://t.co/qXdulxPFk2 #GE2017 #ClaimYourFuture https://t.co/DVqZxJiBf5',866764414707486721,550,13,261,6,jeremycorbyn,117777690,2437876,2950,15241,True
2017-05-22 20:33:07+00:00,"b'Register to vote before midnight tonight ""for a Britain #ForTheMany, not the few"" says @JermainJackman \xe2\x86\x92 https://t.co/qXdulxPFk2 #GE2017 https://t.co/A3v637o0gO'",866753813725708289,590,18,433,11,jeremycorbyn,117777690,2437876,2950,15241,True
2017-05-22 15:04:27+00:00,"b""Don't let them get away with it. Today is your last chance to register to vote. Claim your future \xe2\x86\x92 https://t.co/qXdulxPFk2 #GE2017""",866671101849608192,2017,37,1823,27,jeremycorbyn,117777690,2437876,2950,15241,True
2017-05-22 15:03:14+00:00,"b'They want you to wake up on 8 June without a chance to vote. They just want an elite few to have their say, rather than the many. #GE2017'",866670795568939009,2827,54,1633,41,jeremycorbyn,117777690,2437876,2950,15241,True
2017-05-22 15:02:22+00:00,"b""Tories' manifesto vows to introduce photo ID, which would shut out 3.5 million people, 7.5% of the electorate, from future elections #GE2017""",866670578178174978,1667,105,1157,91,jeremycorbyn,117777690,2437876,2950,15241,True
2017-05-22 15:01:07+00:00,"b""We've just looked through @Theresa_May and the @Conservatives' social media and they've not once asked people to register to vote. #GE2017 https://t.co/Sr8ze2C8jp""",866670262040842240,19613,500,11933,814,jeremycorbyn,117777690,2437876,2950,15241,True
2017-05-22 11:07:16+00:00,b'This election is about you. Today is your last chance to register to vote \xe2\x86\x92 https://t.co/qXdulxPFk2 #GE2017 https://t.co/v5jqdawkeo',866611414722654208,2484,82,1935,145,jeremycorbyn,117777690,2437876,2950,15241,True
2017-05-21 21:35:58+00:00,"b"".@KezDugdale exposes @theSNP's shameful record on education. Labour will build a National Education Service #ForTheMany. #LeadersDebate https://t.co/CKbT4F8x2m""",866407241695588352,499,227,305,48,jeremycorbyn,117777690,2437876,2950,15241,True
2017-05-21 16:26:55+00:00,"b""One my favourite moments of the campaign so far. Watch 9-year-old Hasnain's interview after I answered his question about leadership #GE2017 https://t.co/deGbwACyZj""",866329467203059712,3191,105,1858,156,jeremycorbyn,117777690,2437876,2950,15241,True
2017-05-21 12:50:28+00:00,b'We paused from #GE2017 campaigning to pay tribute to those working to unite communities across the UK. #MoreInCommon https://t.co/0EYtteOj7K https://t.co/NTfzZb9mNI',866274996095774720,992,20,386,13,jeremycorbyn,117777690,2437876,2950,15241,True
2017-05-21 06:30:05+00:00,"b'Today, we will be pausing from #GE2017 campaigning to remember Jo Cox and celebrate that we have #MoreInCommon than that which divides us. https://t.co/864LkXM0co'",866179269315002368,10177,139,4933,129,jeremycorbyn,117777690,2437876,2950,15241,True
2017-05-20 22:01:01+00:00,"b'Tomorrow, we will be pausing from #GE2017 campaigning to remember Jo Cox and celebrate that we have #MoreInCommon than that which divides us'",866051157973651456,5664,78,2100,52,jeremycorbyn,117777690,2437876,2950,15241,True
2017-05-20 21:37:51+00:00,"b""This election is about you. It's about what we can achieve together.\n\nThe Labour Party: #ForTheMany, not the few.\n\n#GE2017 https://t.co/weyKa82fy4""",866045327786336256,16550,455,8940,1413,jeremycorbyn,117777690,2437876,2950,15241,True
2017-05-20 18:15:16+00:00,"b""Great to speak at Prenton Park to this incredible crowd about Labour's transformational manifesto that will deliver #ForTheMany. #GE2017 https://t.co/kC9URMdq8h""",865994347053010948,10311,303,3908,405,jeremycorbyn,117777690,2437876,2950,15241,True
2017-05-20 17:40:26+00:00,"b'Together, united behind Labour\xe2\x80\x99s transformational manifesto, we can deliver #ForTheMany, not the few. #GE2017 https://t.co/mEQ4QIdfoR'",865985580693368832,2394,78,1445,82,jeremycorbyn,117777690,2437876,2950,15241,True
2017-05-20 17:13:06+00:00,"b'Together, united behind Labour\xe2\x80\x99s manifesto to rebuild and transform Britain, we can deliver #ForTheMany, not the few. #Wirral #GE2017 https://t.co/h2EZZZasYo'",865978701263110144,1214,44,546,29,jeremycorbyn,117777690,2437876,2950,15241,True
2017-05-19 18:18:11+00:00,"b'""If 30% more young people vote then we could swing this election."" @Maddy_Hill90 says register to vote \xe2\x86\x92 https://t.co/qXdulxy3Vs #GE2017 https://t.co/uuHI7DjQ6s'",865632692825604097,4096,220,4351,221,jeremycorbyn,117777690,2437876,2950,15241,True
2017-05-19 12:34:06+00:00,"b""Yesterday, the @Conservatives launched their manifesto: for the few.\n\nWatch @UKLabour's launch of our manifesto: #ForTheMany.\n\n#GE2017 https://t.co/tKlFRItsIW""",865546101176139776,1273,80,776,59,jeremycorbyn,117777690,2437876,2950,15241,True
2017-05-19 06:33:04+00:00,"b""There's only 3 days left to register to vote. It's #YourVoteYourVoice so make sure you're heard on 8 June \xe2\x86\x92 https://t.co/qXdulxy3Vs #GE2017 https://t.co/YxkPYV2RZd""",865455243521282048,1028,47,1539,61,jeremycorbyn,117777690,2437876,2950,15241,True
2017-05-18 19:29:26+00:00,"b'.@Theresa_May, why not debate me? The public deserve to see a debate between the only two people who could form the next government. #GE2017 https://t.co/dUNfmjj6Mu'",865288235030904834,10412,876,6794,837,jeremycorbyn,117777690,2437876,2950,15241,True
2017-05-16 15:58:31+00:00,"b'""Don\'t lose your voice. Register to vote. Claim your future"" - @PauljMcGann\'s powerful message. Register now https://t.co/7bYgtgvPDL #GE2017 https://t.co/JrTsZq8RrK'",864510380890050560,2546,110,2568,179,jeremycorbyn,117777690,2437876,2950,15241,True
2017-05-15 21:05:10+00:00,"b""There's only 7 days left to register to vote. It's #YourVoteYourVoice so make sure you're heard on 8 June \xe2\x86\x92 https://t.co/qXdulxPFk2 #GE2017 https://t.co/zfrfaK50SA""",864225165760188419,1012,58,1323,53,jeremycorbyn,117777690,2437876,2950,15241,True
2017-05-14 16:30:03+00:00,"b""There's only 8 days left to register to vote. It's #YourVoteYourVoice so make sure you're heard on 8 June \xe2\x86\x92 https://t.co/qXdulxy3Vs #GE2017 https://t.co/YIPqWerREu""",863793543537598464,854,53,1144,42,jeremycorbyn,117777690,2437876,2950,15241,True
2017-05-14 15:34:15+00:00,"b'Labour will deliver #ForTheMany, not the few. So make sure you register to vote \xe2\x86\x92 https://t.co/qXdulxPFk2 #YourVoteYourVoice #GE2017 @JmeBBK https://t.co/lTQvRCgkt2'",863779499640590340,8573,130,4381,350,jeremycorbyn,117777690,2437876,2950,15241,True
2017-05-14 15:01:15+00:00,b'Discussing with @JmeBBK how important it is for young people to register to vote \xe2\x86\x92 https://t.co/qXdulxPFk2 #GE2017 #YourVoteYourVoice https://t.co/fbnWXPMXIB',863771194725720064,10371,110,5896,417,jeremycorbyn,117777690,2437876,2950,15241,True
2017-05-14 11:36:20+00:00,"b""There's only 8 days left to register to vote. It's #YourVoteYourVoice so make sure you're heard on 8 June \xe2\x86\x92 https://t.co/qXdulxPFk2 #GE2017 https://t.co/oK9Yvpyz1v""",863719626521423872,1341,59,1762,73,jeremycorbyn,117777690,2437876,2950,15241,True
2017-05-11 20:47:18+00:00,"b""If you missed our #GE2017 campaign launch on Tuesday, here's the next best thing: a 360\xc2\xb0 experience of it \xe2\x86\x92 https://t.co/y0OlonhBHB https://t.co/0jr1Sz974a""",862771117030813696,326,29,184,8,jeremycorbyn,117777690,2437876,2950,15241,True
2017-05-10 17:42:16+00:00,"b""If you missed our #GE2017 campaign launch yesterday, here's the next best thing: a 360\xc2\xb0 experience of it \xe2\x86\x92 https://t.co/y0OlonhBHB https://t.co/bbgom2JqFe""",862362163297615876,511,63,339,13,jeremycorbyn,117777690,2437876,2950,15241,True
2017-05-09 20:59:08+00:00,"b'Today, we launched our #GE2017 campaign in Manchester with the message we will take around the whole country: For the many, not the few. https://t.co/ILqa8ZmOnQ'",862049318055931904,1861,119,1136,61,jeremycorbyn,117777690,2437876,2950,15241,True
2017-05-09 15:49:24+00:00,b'Our first TV broadcast of #GE2017 campaign will be aired tonight but you can watch it here first. Labour will govern #ForTheMany not the few https://t.co/3MZzh909uE',861971371919912962,2366,140,1884,126,jeremycorbyn,117777690,2437876,2950,15241,True
2017-05-09 10:23:23+00:00,"b""Honoured @JulieHes is launching Labour's official #GE2017 campaign: #ForTheMany, not the few. Join us on live \xe2\x86\x92 https://t.co/3XVt6pI9k8 https://t.co/ez1EP1TL4j""",861889326262693888,914,61,468,53,jeremycorbyn,117777690,2437876,2950,15241,True
2017-05-09 10:10:00+00:00,"b'.@IanLaveryMP just kicked off our official #GE2017 campaign launch: #ForTheMany, not the few. Join us live \xe2\x86\x92 https://t.co/3XVt6pI9k8 https://t.co/T2OC3VlmKD'",861885958173724673,391,34,236,14,jeremycorbyn,117777690,2437876,2950,15241,True
2017-05-09 10:02:09+00:00,"b""In a few minutes, we're officially launching our #GE2017 campaign: #ForTheMany, not the few. Join us live here \xe2\x86\x92 https://t.co/uMhEP8LUNr https://t.co/Zs1nkRchEF""",861883985206673408,496,45,236,16,jeremycorbyn,117777690,2437876,2950,15241,True
2017-05-09 09:46:00+00:00,"b""In 15 minutes, we're officially launching our #GE2017 campaign: For the many, not the few. You can join us live \xe2\x86\x92 https://t.co/uMhEP8LUNr https://t.co/33355LrcR3""",861879921043492868,322,31,154,10,jeremycorbyn,117777690,2437876,2950,15241,True
2017-05-09 09:36:17+00:00,"b""In half-an-hour, we're officially launching our #GE2017 campaign: For the many, not the few. You can join us live \xe2\x86\x92 https://t.co/uMhEP8LUNr https://t.co/My4m7HxyBu""",861877476590579714,364,35,182,14,jeremycorbyn,117777690,2437876,2950,15241,True
2017-05-08 11:45:44+00:00,"b'The #NHS funding gap should not be filled by charging sick patients, anxious relatives and hard-pressed NHS staff. https://t.co/ava6pLt670'",861547664873312256,1062,106,730,40,jeremycorbyn,117777690,2437876,2950,15241,True
2017-05-07 16:30:46+00:00,"b""Labour will deliver for the many, not the few. @Theresa_May won't. That is why she is refusing to face me in TV debates. #GE2017 https://t.co/FyeQRDJFgM""",861257007650754560,2190,166,1663,90,jeremycorbyn,117777690,2437876,2950,15241,True
2017-05-06 09:41:01+00:00,"b'Now more than ever, we must remember that we achieve more when we stand together than we ever do alone. #GE2017'",860791500640313346,2858,250,1567,124,jeremycorbyn,117777690,2437876,2950,15241,True
2017-05-04 20:01:31+00:00,"b'Today, Labour members are campaigning for our Mayors and councillors who will stand up for you and your community. #VoteLabour https://t.co/yThsewk8tP'",860222878503055361,358,33,156,10,jeremycorbyn,117777690,2437876,2950,15241,True
2017-05-04 19:45:00+00:00,b'Residents in Oxford spoke to me about impact of Tory cuts on public services. #VoteLabour for Mayors &amp; councillors who will stand up for you https://t.co/EluoNy2X4M',860218724770488320,549,39,276,12,jeremycorbyn,117777690,2437876,2950,15241,True
2017-05-04 19:15:01+00:00,"b""At Underhill Circus Shops in Oxford meeting Labour members campaigning in today's local elections. Make sure you #VoteLabour by 10pm. https://t.co/xluirrhKZA""",860211178219417602,333,22,159,7,jeremycorbyn,117777690,2437876,2950,15241,True
2017-05-04 19:00:52+00:00,b'2 hours left to vote in the local elections. Vote for Labour Mayors &amp; councillors who will stand up for you and your community. #VoteLabour https://t.co/bcLeR9RiLu',860207616760455170,466,35,289,11,jeremycorbyn,117777690,2437876,2950,15241,True
2017-05-04 11:17:22+00:00,"b""In today's local elections, vote for Labour mayors and councillors who will stand up for you and your community. #VoteLabour https://t.co/B4d3s1LIcz""",860090973921083394,765,51,563,25,jeremycorbyn,117777690,2437876,2950,15241,True
2017-05-04 10:44:57+00:00,"b'Labour will rebuild &amp; transform our country for the many, not the few. Read &amp; RT my @DailyMirror article #VoteLabour https://t.co/trfvERJxbz'",860082814645129218,728,53,615,22,jeremycorbyn,117777690,2437876,2950,15241,True
2017-05-04 10:23:33+00:00,"b'#VoteLabour today to elect Labour councillors and mayors who will stand up for you, your communities and your public services. https://t.co/fOqi1xrjZL'",860077429523714048,704,36,502,18,jeremycorbyn,117777690,2437876,2950,15241,True
2017-05-10 15:24:40+00:00,b'Theresa May flies by helicopter to meetings of handpicked activists. #GE2017 https://t.co/0hTbCiHfza',862327533974548480,150,22,118,10,tom_watson,14190551,308801,34181,57185,True
2017-06-03 16:19:39+00:00,b'Nice to talk to Shannon and her family in Liscard earlier #VoteLabour https://t.co/0TRv5PS4Sh',871038683398512640,25,4,7,0,angelaeagle,124270074,75720,1988,26064,True
2017-06-03 11:33:56+00:00,"b'All @UKLabour supporters!  Thank you Jill, Andrew, Clive and Violet for your support #VoteLabour #GE2017 https://t.co/UPxQLJfxb3'",870966780344381440,29,4,9,0,angelaeagle,124270074,75720,1988,26064,True
2017-06-03 11:30:33+00:00,b'Lovely to be out in the sunshine in Liscard chatting to voters #VoteLabour #GE2017 #forthemany https://t.co/FboXSv6xqo',870965928170749952,29,1,10,1,angelaeagle,124270074,75720,1988,26064,True
2017-06-01 15:26:44+00:00,"b""True - that's why everyone needs to #VoteLabour and #SaveWirralNHS #ForTheMany #GE2017 https://t.co/xkNWuNNfTU""",870300588386525184,19,5,20,1,angelaeagle,124270074,75720,1988,26064,True
2017-06-01 12:43:55+00:00,b'The Tories want to bring back fox hunting - I will always vote against it   #VoteLabour https://t.co/yufoj334tp',870259616797655040,61,15,27,4,angelaeagle,124270074,75720,1988,26064,True
2017-06-01 07:44:51+00:00,b'Why @UKLabour fought the gagging law &amp; voted against it - #VoteLabour #GE2017 https://t.co/jqiHxZPK5F',870184353682382848,20,0,33,2,angelaeagle,124270074,75720,1988,26064,True
2017-05-30 16:09:45+00:00,b'Great to meet party member Phil Jones from Bootle and Jane &amp; Michael from New Brighton out campaigning today #VoteLabour #GE2017 https://t.co/ysGTWyEqQo',869586637814206468,10,2,6,0,angelaeagle,124270074,75720,1988,26064,True
2017-05-29 20:49:52+00:00,"b""You can't trust the Tories on the #NHS https://t.co/zRskAbtA9E""",869294744844869632,87,7,66,3,angelaeagle,124270074,75720,1988,26064,True
2017-05-29 19:36:19+00:00,b'Wallasey Labour out and about today - The rain held off and the reception was very positive #VoteLabour #GE2017 https://t.co/h5lmdyEKaO',869276235817529344,7,1,5,1,angelaeagle,124270074,75720,1988,26064,True
2017-05-29 13:24:28+00:00,"b""Don't gamble with your future #VoteLabour  https://t.co/2SP2Bm1IUV""",869182655694241792,12,5,23,2,angelaeagle,124270074,75720,1988,26064,True
2017-05-27 21:03:36+00:00,b'Great to see you all! #voteLabour https://t.co/YFzHvssxtv',868573423429201920,17,2,8,1,angelaeagle,124270074,75720,1988,26064,True
2017-05-27 17:45:07+00:00,b'@AngelaRayner Some Wallasey Labour members meeting @AngelaRayner just now #GE2017 #VoteLabour #forthemanynotthefew https://t.co/kD9pYlO821',868523473114673153,40,4,25,1,angelaeagle,124270074,75720,1988,26064,True
2017-05-27 17:41:01+00:00,b'Lovely to welcome @AngelaRayner to Wallasey #2Angelastour #GE2017 #VoteLabour https://t.co/6Doiq3qpBq',868522444201627649,97,6,38,2,angelaeagle,124270074,75720,1988,26064,True
2017-05-26 18:23:21+00:00,b'Good team out on #labourdoorstep tonight in sweltering heat &amp; a warm reception too #VoteLabour #GE2017 https://t.co/Hc4KIE7l67',868170710732218374,26,2,9,2,angelaeagle,124270074,75720,1988,26064,True
2017-05-26 14:55:00+00:00,b'Good to meet Ryan in the New Brighton sunshine #VoteLabour https://t.co/WqmmH9qhzQ',868118275095441408,9,0,3,0,angelaeagle,124270074,75720,1988,26064,True
2017-05-22 16:20:07+00:00,b'Yep - unprecedented Tory manifesto chaos #dementiatax #cantbelieveawordtheysay #GE2027 #VoteLabour https://t.co/dGgaW6bNKF',866690143578705921,27,4,22,0,angelaeagle,124270074,75720,1988,26064,True
2017-05-22 10:31:13+00:00,"b""If that's 'strong &amp; stable leadership in the national interest' then I'm a banana #GE2017 https://t.co/avl4xbH3tZ""",866602342078173185,68,8,42,7,angelaeagle,124270074,75720,1988,26064,True
2017-05-21 11:17:58+00:00,"b""Don't trust the Tories with your future #VoteLabour https://t.co/T8ewFrlENp""",866251717809233920,33,4,36,0,angelaeagle,124270074,75720,1988,26064,True
2017-05-21 09:53:03+00:00,b'#SaveWirralNHS #VoteLabour #GE2017 https://t.co/GDIOSpVO9S',866230347545104384,7,0,13,0,angelaeagle,124270074,75720,1988,26064,True
2017-05-20 16:28:56+00:00,b'I will always vote against this cruelty as well as voting to keep the ban on fox hunting #Votesforvinny #GE2017 #VoteLabour https://t.co/mWRDgqcORd',865967588555227136,36,7,26,0,angelaeagle,124270074,75720,1988,26064,True
2017-05-20 08:33:23+00:00,"b""Just in case you have t noticed what's going on! #GE17 https://t.co/C7g57ByulF""",865847911355121664,4,3,5,0,angelaeagle,124270074,75720,1988,26064,True
